{
  "schema_version": "1.0",
  "contract_id": "lo2cin4bt-app-run-registry-v1",
  "run_id": "20260414_b7c3d8129f4a",
  "entrypoint": "app-run-center",
  "module": "autorunner",
  "status": "completed",
  "created_at": "2026-04-14T13:30:00+08:00",
  "completed_at": "2026-04-14T13:32:12+08:00",
  "symbol": "SPY",
  "frequency": "1D",
  "strategy_mode": "semantic",
  "semantic_label": "spy_mmfi_vix_250d_reset",
  "config_snapshot_dir": "outputs/app/run_snapshots/20260414_b7c3d8129f4a",
  "artifact_manifest_path": "outputs/app/artifact_manifests/20260414_b7c3d8129f4a.json",
  "dataloader_health_path": "outputs/app/run_snapshots/20260414_b7c3d8129f4a/dataloader_health.json",
  "data_lineage_manifest_path": "outputs/app/run_snapshots/20260414_b7c3d8129f4a/data_lineage_manifest.json",
  "lineage_status": "partial",
  "warning_count": 1,
  "error_count": 0,
  "stage_status_path": "outputs/app/stage_status/20260414_b7c3d8129f4a.json",
  "audit_summary": {
    "source_audit_id": "audit_6f331f4a",
    "warning_count": 1
  },
  "artifacts_ready": 6,
  "artifacts_total": 6,
  "warnings": ["metric chart payload still derived from primary metric parquet"],
  "errors": []
}
